{
  "schema_version": "2.1.0",
  "register_type": "NORMATIVE_SOURCE_REGISTER",
  "version": "1.0.0",
  "release_status": "DRAFT",
  "approval_record": null,
  "sources": [{
    "source_id": "SRC-INTERNAL-GOV-2026",
    "title": "Internal AI Governance Process",
    "official_url": "internal://organization/ai-governance-process",
    "authority_type": "INTERNAL_PROCESS",
    "jurisdiction": ["INTERNAL"],
    "effective_status": "VERIFY_AT_ASSESSMENT",
    "last_verified_on": "2026-07-31",
    "approval_status": "DRAFT",
    "owner_authority": "GOVERNANCE"
  }]
}
